{
  "$schema": "https://json-schema.org/draft/2020-12/schema",
  "$id": "https://raw.githubusercontent.com/Zeus-SDR/zeus-community-features/main/schema/plugin.schema.json",
  "title": "Zeus community feature manifest",
  "description": "Authoritative schema for the top-level plugin.json embedded in a community feature ZIP. Schema version 1 is consumed by SDK ABI 1.",
  "type": "object",
  "additionalProperties": false,
  "required": [
    "schemaVersion",
    "id",
    "name",
    "version",
    "author",
    "description",
    "homepage",
    "license",
    "sdk",
    "entrypoint",
    "capabilities",
    "permissions"
  ],
  "properties": {
    "schemaVersion": {
      "type": "integer",
      "const": 1,
      "description": "Manifest shape revision."
    },
    "id": { "$ref": "#/$defs/reverseDnsId" },
    "name": { "type": "string", "minLength": 1, "maxLength": 80 },
    "version": { "$ref": "#/$defs/semver" },
    "author": { "type": "string", "minLength": 1, "maxLength": 160 },
    "description": { "type": "string", "minLength": 1, "maxLength": 300 },
    "homepage": { "type": "string", "format": "uri", "pattern": "^https://" },
    "license": { "type": "string", "minLength": 1, "maxLength": 80 },
    "sdk": { "$ref": "#/$defs/sdkRequirement" },
    "entrypoint": { "$ref": "#/$defs/entrypoint" },
    "capabilities": {
      "type": "array",
      "uniqueItems": true,
      "items": {
        "type": "string",
        "enum": [
          "ReadRadioState",
          "ControlRadio",
          "AudioStream",
          "NetworkAccess",
          "FileSystemRead",
          "FileSystemWrite",
          "PersistSettings"
        ]
      },
      "description": "Declare only capabilities actually used. ABI 1 grants declared capabilities without a prompt."
    },
    "permissions": { "$ref": "#/$defs/permissions" },
    "ui": {
      "oneOf": [
        { "$ref": "#/$defs/ui" },
        { "type": "null" }
      ]
    },
    "audio": {
      "oneOf": [
        { "$ref": "#/$defs/audio" },
        { "type": "null" }
      ]
    }
  },
  "$defs": {
    "reverseDnsId": {
      "type": "string",
      "pattern": "^[a-z][a-z0-9]*(\\.[a-z0-9]+)+$",
      "description": "Permanent lowercase reverse-DNS feature ID."
    },
    "semver": {
      "type": "string",
      "pattern": "^[0-9]+\\.[0-9]+\\.[0-9]+([+-][0-9A-Za-z.-]+)?$"
    },
    "strictSemver": {
      "type": "string",
      "pattern": "^[0-9]+\\.[0-9]+\\.[0-9]+$"
    },
    "packagePath": {
      "type": "string",
      "minLength": 1,
      "pattern": "^(?!/)(?!.*\\\\)(?!.*:)(?!.*//)(?!\\.\\.?/)(?!.*[/]\\.\\.?(?:[/]|$))(?!.*[. ](?:[/]|$)).+$",
      "description": "Forward-slash relative path inside the ZIP. Empty/dot segments, parent traversal, colons, trailing dot/space aliases, and backslashes are forbidden; package validation applies the remaining cross-platform collision rules."
    },
    "sdkRequirement": {
      "type": "object",
      "additionalProperties": false,
      "required": ["abi", "minVersion"],
      "properties": {
        "abi": { "type": "integer", "const": 1 },
        "minVersion": { "$ref": "#/$defs/strictSemver" }
      }
    },
    "entrypoint": {
      "type": "object",
      "additionalProperties": false,
      "required": ["assembly"],
      "properties": {
        "assembly": {
          "type": "string",
          "pattern": "^[A-Za-z0-9][A-Za-z0-9._-]*\\.dll$",
          "description": "Plain top-level DLL filename."
        },
        "type": { "type": ["string", "null"], "minLength": 1 }
      }
    },
    "permissions": {
      "type": "object",
      "additionalProperties": false,
      "required": ["network", "fileSystemRead", "fileSystemWrite"],
      "properties": {
        "network": { "type": "boolean" },
        "fileSystemRead": { "type": "boolean" },
        "fileSystemWrite": { "type": "boolean" }
      },
      "description": "Disclosure metadata in ABI 1, not an operating-system sandbox."
    },
    "ui": {
      "type": "object",
      "additionalProperties": false,
      "required": ["modules", "panels"],
      "properties": {
        "modules": {
          "type": "array",
          "minItems": 1,
          "uniqueItems": true,
          "items": {
            "allOf": [
              { "$ref": "#/$defs/packagePath" },
              { "pattern": "\\.m?js$" }
            ]
          }
        },
        "panels": {
          "type": "array",
          "minItems": 1,
          "items": { "$ref": "#/$defs/panel" }
        }
      }
    },
    "panel": {
      "type": "object",
      "additionalProperties": false,
      "required": ["id", "title", "slot", "category"],
      "properties": {
        "id": {
          "type": "string",
          "pattern": "^[a-z][a-z0-9]*(?:[.-][a-z0-9]+)*$"
        },
        "title": { "type": "string", "minLength": 1, "maxLength": 80 },
        "icon": { "type": "string", "minLength": 1, "maxLength": 80 },
        "slot": {
          "type": "string",
          "anyOf": [
            { "pattern": "^workspace\\.[a-z][a-z0-9-]*$" },
            { "const": "tx-audio-tools.chain" },
            { "const": "rx-audio-tools.chain" }
          ]
        },
        "category": {
          "type": "string",
          "enum": [
            "spectrum",
            "vfo",
            "meters",
            "dsp",
            "log",
            "tools",
            "amplifiers",
            "controls",
            "switches",
            "plugins"
          ]
        }
      }
    },
    "audio": {
      "type": "object",
      "additionalProperties": false,
      "required": ["format", "slot", "channels", "sampleRate"],
      "properties": {
        "format": { "type": "string", "enum": ["vst3", "au"] },
        "auComponentId": {
          "type": ["string", "null"],
          "pattern": "^[^:]{4}:[^:]{4}:[^:]{4}$"
        },
        "vst3Path": {
          "oneOf": [
            { "$ref": "#/$defs/packagePath" },
            { "type": "null" }
          ]
        },
        "vst3Uid": { "type": ["string", "null"], "maxLength": 512 },
        "slot": {
          "type": "string",
          "enum": ["tx.post-leveler", "tx.pre-cfc", "rx.post-demod"]
        },
        "channels": { "type": "integer", "enum": [1, 2] },
        "sampleRate": { "type": "integer", "enum": [44100, 48000, 88200, 96000] }
      }
    }
  }
}
