{
  "schemaVersion": 1,
  "id": "com.example.zeus.helloworld",
  "name": "Hello World",
  "version": "1.0.0",
  "author": "Example developer",
  "description": "Minimal standalone Zeus community feature template.",
  "homepage": "https://github.com/Zeus-SDR/zeus-community-features",
  "license": "GPL-2.0-or-later",
  "sdk": { "abi": 1, "minVersion": "1.5.0" },
  "entrypoint": {
    "assembly": "Zeus.Community.HelloWorld.dll",
    "type": "Zeus.Community.HelloWorld.HelloWorldPlugin"
  },
  "capabilities": [],
  "permissions": {
    "network": false,
    "fileSystemRead": false,
    "fileSystemWrite": false
  }
}
